,keyword
0,第三届全国创业就业展示交流活动即将开幕 首次将劳务品牌纳入主题展示范围
1,1700余处出现险情！山西如何抢救暴雨中受损的文物？
2,江西逾八成国土面积遭遇旱情
3,国家防总启动防汛防台风IV级应急响应 派工作组赴海南协助指导台风“圆规”防御工作
4,湖南汝城致5死房屋坍塌事故后续：5人移送司法机关 20人受到组织处理
5,公安机关依法严打破坏生物多样性犯罪
6,2021年“国际减灾日”北京市主题宣传活动暨第三届“城市与减灾”学术交流会举办
7,台风“圆规”在海南省琼海市博鳌镇沿海登陆
8,造成恶劣社会影响 北京一女子发帖侮辱英烈获刑7个月
9,这份送给老人朋友的重阳节礼物，请查收
10,“圆规”加强为台风级 13日下午到晚上将登陆海南
11,防御台风“圆规” 中国气象局启动Ⅲ级应急响应
12,天津检察机关依法对王富玉涉嫌受贿、利用影响力受贿案提起公诉
13,2021年全国职工乒乓球大赛在京开幕
14,合肥：拼装配 比技能
15,山东潍坊：打造山楂产业 助力乡村振兴
16,原本山川 极命生灵
17,公安部：驾驶证电子化全国第二批推广应用 将新增110个城市启用
18,正确理解共同富裕 以“人人奋斗”实现“人人享有”
19,小雨今夜入京 周末大风降温
20,密云区拥有20种国家I级保护鸟类
21,北京发布陆生野生动物名录
22,湖北襄阳四男子拘禁他人暴力讨债被判刑
23,安徽两公司经理分别被定受贿罪、洗钱罪
24,私家车用作网约车出事故，保险公司赔吗？
25,将9.99元电子书上传网络被判赔1万元
26,隔壁公司“全方位、一比一复制”网红火锅店获利371万
27,中央政法机关督导二组在国家法官学院开展调研座谈
28,国家公园 展现自然之美
29,福建莆田已全域转为低风险区
30,我赴刚果（金）维和医疗分队全力做好疫情防控和医疗救治工作
31,外交部前副部长何亚非：以真正的多边主义重构新时代国际秩序
32,普京任命克里米亚前美女检察长为俄驻佛得角大使
33,肯尼亚拒绝承认国际法院将争议海域划给索马里的裁决
34,秘鲁前驻华大使：中国为发展中国家经济恢复提供重要帮助
35,外交部：反对任何机构或个人借网络安全问题向中国泼脏水
36,新加坡学者撰文批驳“应对气候变化靠中印”错误观点
37,生物多样性大会通过“昆明宣言”
38,莫斯科10所学校将免费为学生提供新冠快检
39,日本京都市发生电车与卡车相撞事故 致1名乘客受伤
40,日本乐桃航空出现史上最大赤字 将推出新服务提振业绩
41,王毅同智利外长阿拉芒通电话
42,IMF认为各国应支持经济复苏并维护金融稳定
43,日本10月12日新增确诊病例611例 山梨等5县零新增
44,日本计划12月启动第三剂疫苗接种 药店获批出售抗原检测…
45,欧盟发行120亿欧元绿色债券
46,日本爱知县发生严重交通事故 致7名小学生受伤
47,“当代中国讲堂”在哥斯达黎加启动
48,阿富汗临时政府代外长说希望与各国进行建设性合作
49,古巴将于下月开始推进接种新冠疫苗加强针
50,中国代表呼吁支持发展中国家维护国家团结和反对外来干涉
51,日媒关注中国电动汽车在日本市场的亮眼表现  批日本车企…
52,英国首份新冠疫情调查报告：最严重的公共卫生领域失败之一
53,美国国会众议院通过短期调高债务上限法案
54,不结盟运动高级别会议呼吁合作解决国际问题
55,索马里政府军从极端武装组织手中收复两个城镇
56,南加州华人举办活动隆重纪念辛亥革命110周年
57,中国代表呼吁让多样性成为重建和平的积极动因
58,美国新冠肺炎确诊4454万 过去四周儿童确诊病例超75万
59,意大利冬季运动联合会举行新赛季新闻发布会
60,俄罗斯萨哈林地区 美景如画
61,美国阿拉斯加州极光 绚丽多彩
62,穿越危险丛林北上赴美移民儿童激增
63,越来越多美国未成年人殒命枪支暴力
64,旅南侨界学习纪念辛亥革命110周年重要讲话精神
65,墨西哥总统指认外国能源商走私燃料
66,伊朗沙特多次对话释放善意 消除紧张状态仍待更多努力
67,接连会晤美欧代表　塔利班称愿与国际社会“积极”交往
68,中国代表强调“基于规则的国际秩序”是对法治精神的违背
69,高质量培育建设国际消费中心城市（观点）
70,各国如何打造国际消费中心城市
71,迪拜世博会开幕10天接待量逾41万人次
72,各国采取气候行动确保疫情后绿色复苏
73,美国仇恨犯罪数量创新高
74,不结盟运动会议呼吁国际社会坚持多边主义
75,反垄断，韩国向谷歌开出巨额罚单
76,意大利：疫苗接种推动疫情形势好转
77,全球氢能产业加速发展（国际视点）
78,王毅出席亚信第六次外长会议
79,中国—联合国和平与发展基金指导委员会举行第六次会议
80,北约驱逐俄外交官引发新对抗
81,“澳英美联盟”严重破坏亚太秩序
82,美陆军接收高超音速导弹
83,俄军大力研发“喷火无人机”
84,内蒙古军区组建国防动员指挥辅助决策专家人才库
85,教育课堂呼唤“精准设计”
86,战前动员的N种“打开方式”
87,第76集团军某旅利用信息技术创新训练方法
88,第72集团军某旅深入开展新装备险难课目训练
89,空军特色医学中心构建打仗型卫勤人才梯队
90,火箭军工程大学打造校园网络综合平台
91,海军航空兵某旅探索远程网络教育模式
92,俄军使用电子战团队对抗无人机
93,印尼再购新舰加快海军现代化
94,美国陆军测试机器人战车
95,广西军地联合推动边海防基础设施升级提高管边控边能力
96,北京军事法院开展军地联合送法进军营活动
97,海军某驱逐舰支队开展实弹射击演练
98,武警广西总队玉林支队开展跨昼夜演练
99,回馈“给你”：铁血男儿家国情
100,俄太平洋舰队在日本海演习
101,海军第38批护航编队执行亚丁湾护航任务纪事
102,改革完善退役军人教育培训政策制度体系的迫切要求
103,海军工程大学围绕战斗力生成急迫需要开展科技攻关
104,俄构筑中亚地区安全屏障
105,美军重启“飞行汽车”计划
106,党政军警联动 强化协同能力
107,“拥军邮路”浓厚双拥氛围
108,涉军维权“一键服务”
109,红色研学“点亮”国防课堂
110,#我们的共同家园#
111,中国从不承认阿鲁纳恰尔邦
112,6岁女孩胳膊发现血点被查出白血病
113,吸毒者不能轻描淡写地说自己是受害者
114,眼周高阶抗老指南
115,临近结婚发现不合适怎么办
116,瘦了30斤之后会有什么变化
117,脱口秀大会排名
118,长白雪奇遇记
119,杨天真让李诞在影帝面前别演
120,微信语音会自动播放朋友圈
121,莆田刑案嫌犯家属深表歉意
122,女儿用钢丝球帮爸爸洗车
123,德国总理听到四川麻辣烫连连点头
124,济南适龄女孩将免费接种HPV疫苗
125,男子按摩花费148元跳楼逃单
126,男子抽搐家人塞勺筷被咬断误吞
127,龚俊说安乐传快杀青了
128,VOGUE新篇章之夜
129,周奇墨脱口秀大会4年度总冠军
130,14岁少年玩游戏刷光父亲8万救命钱
131,河南卫视文化霸总
132,Xiaohu卢锡安延续百分百胜率
133,不跷二郎腿的方法
134,官方回应莆田刑案悬赏通告争议
135,龚俊格纹皮衣造型
136,VOGUE红毯顺序
137,91岁爷爷3年制150根手杖送老人
138,杨幂轻纱遮面复古造型
139,1738元机票提前10天退扣费1182元
140,新人婚礼上合跳鸿雁震撼全场
141,杨笠年度第六名
142,孙红雷感谢黄渤治愈了容貌焦虑
143,任嘉伦评论周雨
144,呼兰说总决赛不能没有王建国
145,莆田刑案嫌犯曾多次发布求助信息
146,杨幂送于和伟横幅
147,官方辟谣甘肃定西发生8.3级地震
148,台湾大葱价格涨至45元1公斤
149,VOGUE红毯生图
150,1小时内4只小猫从高楼坠亡
151,95后大学生和大象谈判
152,121岁奶奶携8位百岁弟妹过重阳
153,八角亭谜雾
154,中文邮件的结尾敬语
155,大熊猫便便可以做成纸
156,玲娜贝儿不喜欢被叫儿儿
157,福建平海镇发布欧某中悬赏通告
158,原来狗狗也知道自己很可爱
159,闫安退出国家队
160,没有什么是冰糖不能裹的
161,为啥送吸管啊
162,Morgan错按闪现
